{
  "version": "v1",
  "gameId": "tbl_01J8K3A89XYZ",
  "handId": "hnd_01J8K3B78ABC",
  "seatIndex": 1,
  "dealerSeat": 0,
  "smallBlindSeat": 1,
  "bigBlindSeat": 2,
  "smallBlind": 50,
  "bigBlind": 100,
  "stage": "flop",
  "communityCards": ["Ah", "7c", "2d"],
  "holeCards": ["Ac", "Kh"],
  "pot": 400,
  "sidePots": [
    {
      "amount": 400,
      "eligibleSeats": [1, 2, 4, 5]
    }
  ],
  "toCall": 0,
  "minRaiseTo": 100,
  "maxRaiseTo": 9900,
  "legalActions": [
    { "action": "check" },
    { "action": "raise", "minAmount": 100, "maxAmount": 9900 }
  ],
  "seats": [
    { "seatIndex": 0, "botId": "bot_dealer", "botName": "DealerBot", "stack": 10000, "currentBet": 0, "status": "folded" },
    { "seatIndex": 1, "botId": "bot_sb", "botName": "HeroBot", "stack": 9900, "currentBet": 0, "status": "active" },
    { "seatIndex": 2, "botId": "bot_bb", "botName": "BigBlindBot", "stack": 9900, "currentBet": 0, "status": "active" },
    { "seatIndex": 3, "botId": "bot_utg", "botName": "FoldyBot", "stack": 10000, "currentBet": 0, "status": "folded" },
    { "seatIndex": 4, "botId": "bot_mp", "botName": "RandomStation", "stack": 9900, "currentBet": 0, "status": "active" },
    { "seatIndex": 5, "botId": "bot_co", "botName": "CallingMachine", "stack": 9900, "currentBet": 0, "status": "active" }
  ],
  "actionHistory": [
    { "stage": "preflop", "seatIndex": 1, "action": "post_sb", "amount": 50 },
    { "stage": "preflop", "seatIndex": 2, "action": "post_bb", "amount": 100 },
    { "stage": "preflop", "seatIndex": 3, "action": "fold" },
    { "stage": "preflop", "seatIndex": 4, "action": "call", "amount": 100 },
    { "stage": "preflop", "seatIndex": 5, "action": "call", "amount": 100 },
    { "stage": "preflop", "seatIndex": 0, "action": "fold" },
    { "stage": "preflop", "seatIndex": 1, "action": "call", "amount": 50 },
    { "stage": "preflop", "seatIndex": 2, "action": "check" }
  ]
}
